{
  "schemaVersion": "1.1.0",
  "issueId": "0193b2a0-0000-7000-8000-000000000601",
  "athleteId": "0193b2a0-0000-7000-8000-000000000001",
  "version": 1,
  "kind": "ANOMALY",
  "activityId": "0193b2a0-0000-7000-8000-000000000101",
  "code": "HR_OUT_OF_RANGE",
  "field": "cardiovascular.maxHr",
  "detail": "245 above 230",
  "status": "OPEN",
  "createdAt": "2026-10-20T22:05:00Z",
  "closedAt": null,
  "resolution": null
}
